id,keyword,location,text,target
1134,blizzard,"Orange County, CA.",VentureBeat: Blizzard is pushing World of Warcraft into the future with Visions of N'Zoth update https://t.co/iCk8HwlUhh by tolkoto,0
1135,blizzard,,baby penguin ian lost in the blizzard https://t.co/yQqRk7o4B9,0
1136,blizzard,ana's mind,PUBG: Provide Unmitigated Blizzard Goop,0
1137,blizzard,,Oh you can all stop saying this movie should get it....blizzard makes better cut scenes in almost every game it makes.,0
1138,blizzard,Fuckmylife,Minnesota niggas will record a video during a blizzard saying “Drive Safe Y’all” while driving 75 miles per hour blasting NB…,0
1139,blizzard,"Madison, Wisconsin",The Blizzard that wasn't and the Futility of Doomsday Climate Predictions https://t.co/B3tv8w0S0Z #WIBAnews,0
1140,blizzard,"Ohio, USA",In my opinion it should definitely be marketed as a premium… https://t.co/y4TVR89Hqy,0
1141,blizzard,,"Yep, we are experiencing an unusually cold spell here in Vancouver (-10C at night and bl… https://t.co/c8pFIdOegO",0
1142,blizzard,UK,Blizzard is pushing World of Warcraft into the future with Visions of N’Zoth update &gt; https://t.co/MDZ0s18xGi… https://t.co/1FilV29oMx,0
1143,blizzard,"The Exodar, Azuremyst Isle",thank you so much Nadd!! ✨✨,0
1144,blizzard,she / her,the only things that aren’t under that handle are prob just like. snapchat or my blizzard acct. i like my brand!,0
1145,blizzard,Ukraine,First Arcanist Thalyssra Fan Art { from weibo } Drawn By Silver Cups 🖌 #Worldofwarcraft #nightborne #Thalyssra #Ar…,0
1146,blizzard,,Looking Back to 1185 Park Avenue in a blizzard on this day 9 years ago: day 449 of 1 photo every day for the rest of m…,0
1147,blizzard,Canada,xeltes played World of Warcraft (Blizzard) in the last 24 hours https://t.co/7Qvvbxc59M #exophase,0
1148,blizzard,His spirit remains in Durotar,It’s trash and at this point I just think blizzard are trying to do what’s worse for this game. Yo PvP… https://t.co/RrQCzReHeB,0
1149,blizzard,,Seriously fuck Blizzard.,0
1150,blizzard,Issa Mystery,You killed it! looks so good!,0
1151,blizzard,Issa Mystery,"Here is Zappy Boi Zekhan, finally finished 💜 so many first times, he was a challenge but I loved working on him. You c…",0
1152,blizzard,"Crenshaw,CA•Beaumont/Hou,TX",🚨🚨WINTER ‘20 IS HERE!🚨🚨 Introducing the “Blizzard Bomber”🔥🔥🔥🚨🚨 Drops online at https://t.co/vL5mRSTof6 tomorrow! Also…,0
1153,blizzard,Radio K - Real College Rado,Nada Surf - Blizzard Of '77 (Let Go),0
1154,blood,Abuja,"Hi, I am Kuchi and I’m hosting a blood drive in Abuja on the 25th of January for in partnership with the Nati…",0
1155,blood,,Powerful words that fell on deaf ears belonging to the rich and powerful people across the globe 'Deliberately &amp; Consciously…,0
1157,blood,,BLOOD ON GOVERNMENT HANDS! https://t.co/GFa6RNRB4w,0
1158,blood,Tanzania,You got covered by the blood of Jesus,0
1159,blood,,?? the only supplement i'm supposed to take is iron and i haven't needed it since i went… https://t.co/qIBWDuVqow,0
1160,blood,"Auckland City, New Zealand","“You’ll be completely immersed in Prince of the Blood II, a phenomenal sequel full of intrigues and many developments, n…",0
1161,blood,"Chicago, IL",i seriously cannot believe that at one point in my life blood on the dance floor was my favorite band and i was straight…,0
1162,blood,Baifra,The Indigenous People Of #Biafra have paid enough in blood for their #FREEDOM! #BIAFRAISNOTONEWITHNIGERIA…,0
1163,blood,"Illinois, USA",Do y’all wanna know what Democrats have done for us? They’ve h…,0
1164,blood,universe,After talking blood from Rohit Sharma's wkt,0
1165,blood,,"A friendly reminder to take your daily vitamin supplements and if you do not take any, get some today. Also get a blood test…",0
1166,blood,,"20/ The super fine lunar dust has such low inertia vs. high aerodynamic drag, that it perfectly follows the air flow all th…",0
1167,blood,,"You are Amee Storm, a pink Simic Barbarian who's from the royal court and wields a blood stained tooth",0
1168,blood,,Working on some blood maledict sets! https://t.co/lfHhS9I7sy,0
1169,blood,"New York, USA",Zep: *shocked* Demigod? I've never met one before. Incredible. What kind of magick can you do? Joshua… https://t.co/37BGiE9m4u,0
1170,blood,regular huh,A FAMILY INDEED. FAMILY. NOT BY BLOOD BUT BY HEART. https://t.co/N9dpX1FnFo,0
1171,blood,Tel'aran'rhiod,That's mere 5 pints of blood lol...,0
1172,blood,,I have O- blood type. If I make a trip there from the US will Malta accept it? It won’t be an imme… https://t.co/nT4Ql4u1Z1,0
1173,blood,,it makes my blood boil seeing that they are asking jongdae to leave. its so unfair. the worse part is jongdae is pr… https://t.co/Zav91kCI29,0
1174,blood,,Blood sweat and tears #BoyWithLuv #BestMusicVideo #iHeartAwards,0
1175,blood,"Johannesburg, South Africa",Actress chats to her acting debut on Giyani Land of Blood and her career: https://t.co/sFHCVqG1Ts https://t.co/4uh7m9rsM2,0
1176,blood,India,"India's ""collective conscience""is not the conscience of the poor, the marginalised. It is the conscience of the middle and…",0
1177,blood,Lincolnshire,"BEST OF THE SEASON // Blood oranges, Seville oranges and forced rhubarb are brightening up the #FarmShop this week. T…",0
1178,blood,"Uttar Pradesh, India","Dear heart, please stop getting involved in everything. Your job is to pump blood, that's it.",0
1179,blood,,#Sialkot alert! A- blood in needed Sadar begam hospital Sialkot 03077212577,0
1180,blood,,Myghaad!! Who needs blood transfusion?? DM me https://t.co/xQxxXZnCFK,0
1181,blood,,Iran in blood We are hostages #NancyPelosiFakeNews https://t.co/LOHu07MSLH,0
1182,blood,,"/ #blood NEED: #dadu Me Hik Zaroratmand Aurat Khe Emergency Me O-ve #blood Ji Sakht Zarorat Ahe Insan Dost Rabto Kan, Co…",0
1184,blood,,"RT #URGENT #O+ blood group required at Shalimar Hospital, #Lahore. Please contact on 03486211155. #SpreadTheWord #dona…",0
1185,blood,"Atlanta, GA","My niece is still in the hospital, waiting for a neurologist to see her. She may have a B12 and/or a folic acid deficie…",0
1186,blood,,"#RT #URGENT #Any blood group required at Holy Family, #Rawalpindi. Please contact on 03145411414. #SpreadTheWord #do…",0
1187,blood,,Five more months of stuggle blood sweat and tears,0
1188,blood,"Wisconsin, USA","This proves how total metal Your attitude is. I wander what to put in a ""Christian mum"" mailbox for a pres…",0
1189,blood,"Cape Town, South Africa",Western Cape blood stocks down to just four days by Shakirah Thebus Western Cape blood stocks will only last for… https://t.co/RprLMnbNS2,0
1190,blood,India,All those who welcomed the hanging of #AfzalGuru have blood on their hands. The least we can do is offer a useless sor…,0
1191,blood,,My blood is boiling right now 😤🤯but I wouldn’t expect anything less from the racist mofo!!! Arabs/S… https://t.co/nlpLDICtcI,0
1192,blood,"Kampala, Uganda","So Rwigyema Gisa Fredrick is being sidelined here😂😂😂😂 They faught a bush war,heavy and wonderful. Unt… https://t.co/eCq5zyrvbS",0
1193,blood,"Rio de Janeiro, Brasil",faça uma playlist com as letras do seu nome: adore you - harry styles none but jesus - hillsong united more than a… https://t.co/DjNmV4h0eD,0
1194,blood,,The approved textbook for 8th Grade CHILDREN in California. 13 14 yrs old. “Anal sex. Body fluid or blood play” These cla…,0
1196,blood,République Togolaise,Does Joe Gomez keep his place now that Joel Matip is back fit? It's one of the big talking points of the Blood Red podcast…,0
1197,blood,🇳🇱,"I don’t be wishing my exes would be forever single or miserable. Pls go find love. Get married, have kids. Do all that. If…",0
1198,blood,"221b, baker street",I cover my eyes with the blood of Jesus. Brother Fisayo please what is this? Desist from your sinful… https://t.co/UTQExuWF2a,0
1199,blood,,"Very bad night, have to go for a blood test which has relocated to beside the entrance to psych ward I was on. Fill… https://t.co/rE8fi92Ijc",0
1200,blood,,"Its ignorant comments like these, tgat make my blood boil. #Oman #قابوس_في_ذمة_الله https://t.co/l35RAtQ3sw",0
1201,blood,"Aylesbury, UK","""Meghan became a target because she is a mixed-race American with no aristocratic blood, who dared to import vaguely progr…",0
1202,blood,,are we gonna have a version of this in the mv? thats what im thinking.. didnt we get a olivia teaser of her eating an the blood…,0
1203,blood,,The way they’re twisting feminism to their favor is making my blood boil. Shaming a woman for being pregnant before marria…,0
1204,blood,"Stockholm, Sverige","Relatives of the war criminal (Shohrat zakir )are attacking their opponents in the streets illegal, thi… https://t.co/ed9v43x35I",0
1205,blood,"Kolkata, India",everyman/woman who doesnt exactly belive in that must b kiled; evrythng that does… https://t.co/MtupW8m9Rt,0
1206,blood,Illinois,"When Iran’s ayatollahs took over 40 years ago, we did not help the Iranians. Their entire way of life changed so drama…",0
1207,blood,"England, United Kingdom",Just ring ding dong it🤗. It's over in a second. Blood tests always make me anxious but it really isn't ba… https://t.co/xAOjsqNdfc,0
1208,blood,"Minneapolis, MN",It used to be the other way around until 20 years ago. The richer you were the more likely you’d be audited. Now the IR…,0
1209,blood,,LaBeouf You counter to the dark woods (Shia suprise) there's blood on Hope! You move stealthily toward,0
1210,blood,,no but srsly they look so alike are they blood related https://t.co/yUwKOF0H6c,0
1211,blood,,giorno: what’s your blood type? fugo: how would i know? giorno: how would you not? fugo: who do you think i am? karl…,0
1212,blood,,Why does she have blood on her finger?,0
1214,blood,Mountains of British Columbia,You guys love saying that. Its the most blatantly arrogant thing comin… https://t.co/6ZMOfiF2E9,0
1215,blood,Delhi,Blood boiling not for batting position of virat kohli but for what this team has done with shreyas iyer,0
1216,blood,"Winchester, England",How cool! It’s amazing how things have changed with technology. Unfortunately they won… https://t.co/kI4awluPs4,0
1217,blood,,We’re tired of the same old zombies. Time for new blood!,0
1218,bloody,,"Nigerian Military Cadets Cause Hold up Expressway because the ""bloody civilians cannot do anything"" https://t…",0
1219,bloody,,Bloody hell! Just saw this Chris. I'm so sorry. My condolences.,0
1220,bloody,"Ballarat, Victoria",He's just shithouse at leading. Seriously. That's it. We… https://t.co/RJgVDq3r8C,0
1221,bloody,"England, United Kingdom","🇮🇹 Totti is 43 years old and he’s still scoring bangers like that. Class is permanent., what a bloody goal. 🔥 https://t.co/RhZptTltyF",0
1222,bloody,USA,"Western Islamist hypocrites exploiting the #RegressiveLeft’s narcissism, to portray a bad yet democratically elected Presi…",0
1223,bloody,"South East, England",another day another 20 Minute delay. So far you have started the day on a high. 9 journeys since the 6th J… https://t.co/M93EVp4Ydw,0
1224,bloody,,Those eyes are bloody gorgeous,0
1225,bloody,,"Good grief, that's not a shower, that's a fucking jet wash. Have to be careful not to aim at the ceiling, we'll take the bloody paint off.",0
1226,bloody,"Newcastle, Australia",Bloody hell- I’ve got some work to do!!,0
1227,bloody,"London, England","mike didn’t bloody sit about did he, he got up quicker than me when my dominoes arrives #LoveIsland",0
1228,bloody,,"Usually, the lake is a water source for helitechs, today it was the good old #Wanneroo BFB pumping it out, that's h… https://t.co/1OiWcsEnmH",0
1229,bloody,,"I want to get my pussy eaten but I'm on my period, who is freaky enough to get bloody?",0
1230,bloody,,Unbelievable!! Arundhati Roy is smiling where these slogans are chantted Kashmir Tere khoon se inqalab aayega Delhi…,0
1231,bloody,FARIDABAD,It will just take a random google search to know about the media mavens of the day who helped the political plus bureaucr…,0
1232,bloody,,"The bloody coward made sure he entered the field *WITH* the troops to ensure he wouldn't be booed, since t…",0
1233,bloody,,"AHHHHHH, SHHHHHIT! I BLOODY HATE FROZEN!",0
1234,bloody,From Westminster to Hong Kong,Taiwaners know what they’re talking about here. Repression esp. pre-87 under the KMT was often bloody. In 1989 I was caught i…,0
1235,bloody,"England, United Kingdom",This needs to be trending #whiteophobia Sick and tired of the bloody race card! Just being white gets us non stop… https://t.co/1aAuG30ERN,0
1236,bloody,,Read this before you buy the propaganda that the government in Iran is unpopular. The dishonest media and people in our g…,0
1237,bloody,Gräfenberg Spot,Gentle Reminder,0
1238,bloody,,They already exposed what Iran did by stating Iran shot down that plane. T… https://t.co/HlkEmWHA39,0
1239,bloody,Australia,... on the way to my house with my fish burger no doubt. What a bloody little Anzac.,0
1240,bloody,Poisoned Candy Land,Bloody hell there was a lot of binges this morning! On a Tuesday morning too?! One Gooood boy catching up and a few new…,0
1241,bloody,"Portsmouth, UK",The bloody + brutal history of tea production in the modern age is starkly at odds with the familiar marketing of a cup o…,0
1242,bloody,"Edinburgh, Scotland",I'm finally reading the Not So Stories anthology* and barely ten sentences into 's introduction I'm cr… https://t.co/hF0CMppbbl,0
1243,bloody,,"I got isolated by a few colleagues due to a misunderstanding, pretty much they said things behind me but I learnt not to giv…",0
1244,bloody,Sri Lanka,Please stay as you are Ismail. You are bloody perfection personified 😂😂😁,0
1245,bloody,"melbourne, australia",Bloody hell I hope you’re not next!,0
1246,bloody,,🛑 🛑 🛑 Bloody Harvest—How Everyone Ignored the Crime of the Century- ⁦⁩ has penned a piece that you should drop e…,0
1247,bloody,"Mannheim, Germany",Taiwan President Tsai Ing-wen's speech: People joining legal demonstration will be protected by police. We are free fr…,0
1248,bloody,"Windsor, South East",Why is no one talking about these robot animal things they’ve just made in bloody Vermont?! Science has just invent… https://t.co/PJdv34fCdq,0
1249,bloody,"Seaford, Victoria, Australia",You’re a bloody amazing human on and off the course. 👍,0
1250,bloody,"England, United Kingdom",Bloody hell there was a lot of binges this morning! On a Tuesday morning too?! One Gooood boy catching up and a few… https://t.co/vn24U6wbxi,0
1252,bloody,,"I knew United were talking about a rebuild, but I didn't expect a bloody Lego set...",0
1253,bloody,A Manc in Soul Heaven,"Really, oh bloody hell! 🙄",0
1254,bloody,"Malaga, Spain",I’m the same but against Preston where I was (NE) the atmos was bloody awful. I know we’re all beat… https://t.co/cZdfDVhSKc,0
1256,bloody,"Belfast, Northern Ireland",Most underrated album!! Bloody outstanding!! https://t.co/NPQjObW1kv,0
1257,bloody,,BBC as usual making my blood boil. Patting yourselves on the back. He is doing ok. You didn't tell u… https://t.co/Kz2isDTkLy,0
1258,bloody,London,"Our teen Junior Judges bloody loved BLOOD MOON. Fresh, positive and empowering on first love, friendships and rejecting…",0
1259,bloody,"Melbourne, Victoria","It’s a bloody good response dun-man, makes sense!",0
1260,bloody,,It's become more about the bloody presenter than the weather! BBC weather is worse! T… https://t.co/RYjunkN2dn,0
1261,bloody,"Canberra, ACT",Sitting in the front room with my bride and the bloody dog eating peanuts out of my hand listening to Allegri’s Miserere - as you do...,0
1262,bloody,Quantum of my Solace,Bloody hell.,0
1263,bloody,,BREAKING: Lose your heart over our final list of extras on our Feb 11th Blu-ray release of 1981's MY BLOODY VALENTINE!…,0
1264,bloody,"Georgia, USA",Past Democratic primaries have been truly brutal - millions of dollars of paid ads with negative personal attacks etc. Fo…,0
1265,bloody,"Mumbai, India",Who does this bastard Jayakrishna think he is? Bloody third rate airline with… https://t.co/O6WJp3v1UM,0
1266,bloody,Pocket DimensionX,"😂😂😂😂 You're the Best Djoko, more wins for you this year!",0
1267,bloody,,"This is so bloody important. Read, investigate, understand. Don’t be the person that denies the thing just because they’…",0
1268,bloody,,"Once PlayStation 5 and Xbox Series X are out, it's gonna be like PS3/360 where the new consoles will be held back b… https://t.co/FFmfg53y6Y",0
1269,bloody,,The media keeps harping on about how shit Scomo has been (which is true) - But barely mention how bloody brilliant Albo ha…,0
1270,bloody,,Let us begin by taking a look at the very concept of the US trying to trick an enemy nation into downing a civilian airliner.…,0
1271,bloody,,Bloody bcci They sold rights of even highlights,0
1272,bloody,Hell.,"""...Bloody Maury"" ""...Bloody Maury"" ""...Bloody Maury"" [Faintly] ""You... Are the father"" [SCREAMS]",0
1273,bloody,,emily blunt as athena your words have always been your most dangerous weapon. make it bloody if you have to. https://t.co/0wnkov4DY9,0
1274,bloody,"Wien,Niederösterreich,Mallorca",There was a damn good reason why the hazardous trail was known as the ‘Bloody Bozeman’. Will Joel &amp; his companions make…,0
1275,bloody,"Tangerang, Banten",Save Jakarta from bloody greedy person! Kawal anggaran 90T tanpa program dan itu ua gnya pada kemana? Jawab nis! #JKTBe…,0
1276,bloody,"Wales,UK",Bloody hell he's got some front he can stick Big Ben up his arse,0
1277,bloody,,Bloody HELL https://t.co/IKhk6FwWbd,0
1278,bloody,ghaziabad,No bloody case manager is looking into it I need my whole money back and also compensation for this fucking nuisance,0
1279,bloody,,Another Dividend win! Oh wait there are 2 media days in the next 3! 🚀🚀🐝🐝 fully expect £5 before he signs! Fernandes could we…,0
1281,blown%20up,Venus,People choose what's art. There are tattoos that are peoples heart beat. Do you. Get them blown up and framed.,0
1282,blown%20up,Great Whin Sill,Our ‘#RoyalCrisis’ isn’t really a royal crisis. It’s a media crisis. Created by the media. Fuelled by the media. Shaped b…,0
1283,blown%20up,134340,"remember when namjoon recommended khalid, billie eilish and H.E.R even before they blown up.. yes namjoon really has sharp…",0
1284,blown%20up,"Wicken, Ely","Not denying this comparison but this article was done with bias. Kate was hounded for years, label… https://t.co/nlDKoliOIE",0
1285,blown%20up,East of England,You’re a blabbering no nothing idiot. You said he did 20 years on active service!!!! Do you think he joined up at 5 years…,0
1286,blown%20up,Bloomington,You aren’t a real gamer unless you’ve blown into an old Nintendo game cartridge and shoved an N64 controller straight u…,0
1287,blown%20up,,I have had shit my entire life. I was bullied and beaten up for the 5 years of my secondary school because at t…,0
1288,blown%20up,Somewhere with Nash and Nahla,It’s so loud though 😰 my dogs were certain our house got blown up 😂,0
1289,blown%20up,,i just wanted to say really quick that i liked season 1 a lot BUT i LOVE season 2. knj really stepped up the game and mad…,0
1290,blown%20up,"Bristol, England","If I could show you the nerves, excitement, and anxiety leading up to today’s announcement... I’m just blown away and so…",0
1291,blown%20up,,"FLASHBACK- 2.3 TRILLION MISSING PROVES 9/11 WAS AN INSIDE JOB: On 9/10, $2.3 trillion went missing from the Defense Depar…",0
1292,blown%20up,New york,"‘Bloodshot’ Trailer Tomorrow, Crazy Violent Teaser Today! [Video] The first Bloodshot teaser was absolutely bonker… https://t.co/MxTgIpq6yO",0
1293,blown%20up,,So there’s like a 4.1% chance of being blown up lmaoooo so I get the gamble but really you’ll just ha… https://t.co/pDBkMcXc4E,0
1294,blown%20up,Metaverse,can this get blown up please 😭😭😭😭 https://t.co/MdBa1QjRUk,0
1295,blown%20up,Metopia,"The instant Ghafoor said F16s weren't used, it was clear to any thinking person F16 wasn't shot down. G… https://t.co/vToFhkmxK7",0
1296,blown%20up,United Kingdom,"Royal situ is tough, but there's defo people being blown up and seeing their countries dessicated by conflict. But… https://t.co/5ZaErbnzOD",0
1297,blown%20up,"Long Beach, CA","NO FUCKING WAY. My mind is blown rn, wow. Brb. Ima go buy some art from some talented and up coming artists..",0
1301,body%20bag,,"This doctor @ my job bought me a gift bag bc it was his last day there, it’s FILLED w/ goodies, Bath &amp; Body Works, Neutro…",0
1303,body%20bag,,"Description: KamAZ 55102-Power: 300 HP; – Speed: 85 km / h; – fuel tank Capacity: 400 l.; – Cost: 74,100€; – body C… https://t.co/UKJ8HTqa35",0
1305,body%20bag,,"1st - “rice bag convert” is a casteist slur”, should file a case against you. 2nd, if all it took was a “rice ba…",0
1309,body%20bag,Worldwide!,Yoga Lotus Spike Acupressure Mat Pillow Set Back Body Massager Acupuncture Cushion Mat Relieve Stress Tension Pain… https://t.co/LxmAZQS2Uw,0
1310,body%20bag,pg,x “Body Bag 2” (Official Video) https://t.co/dPrVs15HGQ 🎥 🎹 https://t.c…,0
1313,body%20bag,,"First I'll body bag your Fox, then dot zip it shut",0
1314,body%20bag,,That situation tends to end with the attacker shot. That would not go over very well in some places.… https://t.co/ElHAEtyaqf,0
1315,body%20bag,"Lagos, Nigeria",Certified kneeling machine. Za BODY BAG GOVERNOR...,0
1316,body%20bag,"Manhattan, New York","Jackson couldn’t sleep. He grabbed a coat before running out the door, had his messenger bag slung across his body as u…",0
1320,body%20bag,5223 MorrisAve|MaxBlock,x “Body Bag 2” (Official Video) https://t.co/dPrVs15HGQ 🎥 🎹 … https://t.co/t9e4Nhuywl,0
1321,body%20bag,,"Jackson couldn’t sleep. He grabbed a coat before running out the door, had his messenger bag slung across his body… https://t.co/zdoPvLOLiz",0
1322,body%20bag,,krystal always brings body lotion in her bag.,0
1324,body%20bag,United States,Drone Fans 1 Pc Storage Spark Mini Drone Body Battery Bag +1 Pc Portable Handheld Remote Controller Case for DJI Dr… https://t.co/u98DtVCvrn,0
1325,body%20bag,"Ibadan, Oyo state, Nigeria","Frisking passengers just before boarding local flights, without checking their hand luggages makes no sense to me. I mean, I…",0
1326,body%20bag,KxO,"For us, tea is about more than having a healthy body &amp; mind. It’s about treading lightly on the planet too 🌎 ⁣ ⁣ Have yo…",0
1327,body%20bag,"Benin-City, Nigeria","Karma is bad ""psychosis"" affects HellElrufai brain to process information, it causes him to lose touch with…",0
1328,body%20bag,"Benin-City, Nigeria","Karma is bad ""psychosis"" affects HellElrufai brain to process information, it causes him to lose touc… https://t.co/eZGrLEU6aQ",0
1329,body%20bag,Quezon City,Buri handwoven bags : • Buri handbag - Php 280.00 • Buri pencil case - Php 40.00 • Buri body bag - Php 200.00 • Bu… https://t.co/deSlkVMT8A,0
1330,body%20bag,"Hollywood, FL",Quise - Body Bag Ft. Gunplay,0
1334,body%20bag,"Texas, USA",Body Bag...,0
1336,body%20bag,,Yo! I was just telling my boyfriend that I was trying to eat healthier to prepare my body to have children (as I wa… https://t.co/J0r825kpsd,0
1340,body%20bag,,Brand: ANELLO Product name: Body bag AU-A0213 Camouflage ©️DAUMCAFE #한승우 #승우 #엑스원 #X1… https://t.co/u82fKtj6Qg,0
1342,body%20bag,"Cleveland, OH","Typo. Yes, coroner. Witnesses confirmed body bag leaving the vacant house along with multiple evidence bags.…",0
1347,body%20bag,South Africa Johannesburg,"The mind leads, and the body obeys #IronParadise another session body bag https://t.co/hi8klyWRKR",0
1349,body%20bag,Ghana,Joy Superhero St…,0
1351,body%20bag,171006 180929 100208|| VERKWAN,hello bale pwedeng body bag or sling? tama po ba?,0
1352,body%20bag,"Los Angeles, CA",Yuck! Looks like she's wearing a body bag. Maybe because she's dead on the inside. No soul.,0
1354,body%20bag,,"14/1/2020. Got up 8:00am, breakfast, then a morning walk. 10:15am drive to east Auckland to pick up a $10 body boar… https://t.co/iG2X5xaV6W",0
1357,body%20bag,United States,"Trump is just a big bag of lies! Everytime his beady eyes shifts, more lies come out. OMG! How can o… https://t.co/zmPVKTxdXg",0
1360,body%20bag,OC w/ FC of Allen Walker (DGM),"Allen let his eyes close, simply feeling the continued headpats and letting his body be lulled into… https://t.co/BlkJkYR5CN",0
1362,body%20bag,Nigeria,Khali can body bag Blaq.,0
1363,body%20bag,"Sarasota, Florida",Jan 2020 News is GUILTY PLEA. USUALLY BRINGS CO-OPERATION. (or a body Bag) – more leakers who to be arrested –&amp; m… https://t.co/it7Q5yZC06,0
1365,body%20bag,"Roodepoort, South Africa",You leaving in a body bag,0
1366,body%20bag,,First I'll body bag your Fox,0
1368,body%20bag,,I would like to wax my unconscious bag in THC and rub it all over your body.,0
1369,body%20bagging,WhERE tHE bAG at ‼️,IS STILL THAT BITCH 💅🏽 Now Y’all Know She About Body Bagging You Hoes☺️ https://t.co/yOYH9i3qoJ,0
1370,body%20bagging,O-Town Pennsylvania,#chiefs outscored #texans 51-7 after the 24-0 start. I think KC fans got mocked for saying we’d be different with… https://t.co/ZMUjU5WIt3,0
1371,body%20bagging,"Texas, USA",Prayers for you all. This will be America if a DemocRat gets elected with the help of B… https://t.co/TVgMXYoPwV,0
1372,body%20bagging,"Atlanta, GA","No way I get either of them down, but Derrick Henry body-bagging dudes every week is making me feel a bit nervous",0
1373,body%20bagging,United States,Damn ..... I mean after body bagging you guys last year and some what this year.. I th… https://t.co/pR4qCPEiBU,0
