id,keyword,location,text,target
5903,flooding,,"Received video from Bukavu, DRC where heavy rain &amp; flooding this weekend has led to 13 people being killed. https://t.co…",1
5905,flooding,Oxfordshire,"""We’re in a state of anxiety, shock &amp; grief. This is #ClimateChange. This is what a +1.5 degree world looks like"" …",1
5908,flooding,Ballycastle,"Storm surge from Storm Brendan flooding the harbour on Rathlin Island, off the County Antrim coast. Footage from Dougl…",1
5910,flooding,Spain,VENICE RUNS DRY: Gondolas stranded in mud just two months after severe flooding #venice #gondolas #flooding… https://t.co/TkS4Tk21xi,1
5913,floods,"Dover, England",Water levels in Venice drastically drop two months after floods https://t.co/MfX4hfTAwe,1
5917,floods,"Karachi , Pakistan","It's literally been two weeks into 2020 and we have already seen the Australian fires, volcano in Philippines, record breaki…",1
5919,floods,"Rawalpindi, Pakistan","Unprecedented floods are ravaging #Iran's Sistan &amp; Baluchistan province, with significant human &amp; material costs. Even as sear…",1
5921,floods,"Kent, UK","Venice canals almost dry, two months after severe floods - https://t.co/5XXdyMnecU #GoogleAlerts",1
5922,floods,"Kent, UK","Venice canals almost dry, two months after severe floods https://t.co/Qt0Il9semQ",1
5927,floods,"Dublin, Ireland",Water levels in Venice drastically drop two months after floods https://t.co/MfX4hfTAwe,1
5928,floods,"Pontevedra, Spain","Venice canals almost dry, two months after severe floods https://t.co/27zxHQQPc7",1
5932,floods,Oban,Sting in the tail as Storm Brendan hits Oban https://t.co/PESh2PpB9h https://t.co/9ZJfn74uue,1
5935,floods,,"Venice canals almost dry, two months after severe floods - https://t.co/5XXdyMnecU #GoogleAlerts",1
5941,floods,"Russia, Saint-Petersburg",Exceptionally low tides leave Venice's canals nearly dry just 2 months after floods https://t.co/BtDSeyJPQt https://t.co/M…,1
5943,floods,"Seewis im Prättigau, Schweiz","Busy night for our #RapidMappingTeam While working on the #TaalEruption in the Philippines, we received another activati…",1
5945,floods,#ImpeachTrump,"Snow, rain and flash floods leave dozens dead in Afghanistan and Pakistan: At least 43 people are dead in Pakistan and Afghanis…",1
5947,floods,London 4ever,"Venice canals almost dry, two months after severe floods https://t.co/zbyrK3WhTN",1
5948,floods,,"Low tide leaves Venice's canals dry, just months after severe floods https://t.co/irGhhYexMr via",1
5951,floods,Brussels,#Sentinel2 2020-01-13 Sistan and Baluchestan #Iran Heavy rains generate floods in Chabahar County bands 8/4/3 Data …,1
5954,floods,"West Bromwich, England",I can confirm #StormBrendan has arrived in Worcester. Awful conditions out so take it easy out there. On the roads? S…,1
5955,floods,Kota Tanjung Pinang,"Venice canals almost dry, two months after severe floods https://t.co/P0S6w6voTU",1
5962,forest%20fire,"Colorado Springs, CO",Hikers doing their best to outdrive a forest fire https://t.co/n3YlQfMGYz,1
5967,forest%20fire,The Beach,Tonight I've seen this fire 🔥 above Tokeh village increase from a small fire to this in just 2 hours. This needs to st…,1
5968,forest%20fire,"Lagos, Nigeria",It was a crazy weekend here in Virginia. Very high winds and a large forest fire close to our house. Thankfully the rain…,1
5988,forest%20fire,near the forest,A ‘resprouter’ eucalypt forest burned by high-severity fire near the Macalister River in eastern Victo… https://t.co/VgX9H4zxYA,1
5998,forest%20fires,Rwanda,Is that so❓ That's too bad.🙀 Australia has many forest fires.🔥 I´m concerned about firefighters too.🚒👨‍🚒,1
5999,forest%20fires,,"200112 SECHAN INSTAGRAM ""Hi, this is Sehun &amp; Chanyeol. The damage from the forest fires that began 5 months ago in Aust…",1
6008,forest%20fires,,It is terrible news what we see on TV every day about those forest fires. Terrible for all those peopl… https://t.co/vx2jaFBXCW,1
6010,forest%20fires,,Pawcept: Australia and Amazon Forest Fires: Cheering the Ch... https://t.co/KxqLGw8eTt,1
6016,forest%20fires,USA,Pray for Australia Forest Fires shirt https://t.co/IyRT65zN2R https://t.co/HNPSeOb2Xx,1
6020,forest%20fires,,The fires are in #Australia now but come this summer we will be fighting our own battles against forest fires. We're…,1
6024,forest%20fires,"กรุงเทพมหานคร, ประเทศไทย",Its crazy and sad to see the current fires happening in the amazon rain forest! I was lucky to visit last year to…,1
6030,forest%20fires,USA,Pray for Australia Forest Fires shirt https://t.co/YQka8OgjL1 https://t.co/jrU2b3v0SF,1
6031,forest%20fires,,Is that so❓ That's too bad.🙀 Australia has many forest fires.🔥 I´m concerned about firefighters too.🚒👨‍🚒,1
6044,hail,Tasmania,"#Thunderstorms are possible across #Tasmania Wednesday afternoon after a warm, humid and smoky start to the day. Hail or short…",1
6045,hail,Huntsville  Alabama,Heavy rain and storms move through the Shoals this morning. Lightning and small hail possible. https://t.co/4n7MXERnFB…,1
6075,hail,"Mumbai, India","Isolated thunderstorm accompanied with hail/lightning also likely over Punjab, Haryana, Chandigarh, Rajasthan, Uttar Prad…",1
6078,hail,"Jackson, KY",Showers and a few storms will affect the area early this morning with cloud to ground lightning and small hail the… https://t.co/CdHmXjeiF9,1
6084,hailstorm,"Rawang, Selangor",Hailstorm in Canada ⛈ https://t.co/LNpb1JwyRi,1
6087,hailstorm,"New Delhi, India",Hailstorm in North Haryana https://t.co/4EkRqWgsKQ,1
6088,hailstorm,Australia,March 22 I will commemorate the Great Perth hailstorm at 4PM the time when the storm hit us causing billions…,1
6089,hailstorm,"Perth, Western Australia",March 22 I will commemorate the Great Perth hailstorm at 4PM the time when the storm hit us causing b… https://t.co/UIwTu4Nv3H,1
6104,hailstorm,Colorado,Colorado Springs 8/6/2018 hailstorm getting recognition in significant weather events recap from - Doing 2018 rec…,1
6133,hailstorm,"Chennai, India","UAE bracing up for heavy rain, hailstorm in UAE https://t.co/ktJebZ8RQl",1
6220,hazard,,⚠️ ROAD HAZARD - Please be aware that we have received reports of a pothole causing issues to vehicles travelling on Moun…,1
6241,hazard,Malaysia,Hazard on E2 Lebuhraya Utara Selatan #kltu. Traffic moving 11m slower than usual. https://t.co/0viourXizm https://t.co/Cc47pQrJVT,1
6244,hazard,Johannesburg,Yeyi! That one on 6th was a massive hazard! almost took himself to his grave the other day.,1
6256,hazardous,"San Diego, CA",The air quality is well over hazardous levels in Melbourne today. No one should be doing physically strenuous work outsid…,1
6257,hazardous,"Police Point, Tasmania","Melbourne joins Sydney, Canberra and hundreds of regional towns having hazardous air quality Wonder who the climate denie…",1
6258,hazardous,"Bristol, England","Today Melbourne’s air was the most polluted in the world with AQI readings up to 758, 2x hazardous levels. It’s so bad tha…",1
6259,hazardous,,Hazardous eruption a possibility after Philippines volcano erupts https://t.co/cwtpUi602z via Another natu… https://t.co/MGQRjKKqpp,1
6260,hazardous,Republic of the Philippines,ERUPTION UPDATE FOR TAAL VOLCANO ALERT LEVEL 4 (HAZARDOUS ERUPTION IMMINENT) 14 JANUARY 2020 01:00 PM #TaalVolcano #Ta…,1
6261,hazardous,Alphen aan den Rijn,Hazardous eruption a possibility after Philippines volcano erupts https://t.co/o9qtzfwe5D,1
6262,hazardous,"Melbourne, Victoria (Boon wurrung)","Melbourne's air quality on Tuesday morning is at levels worse than predicted due to an influx of bushfire smoke, plummeting to…",1
6263,hazardous,,The #airquality in Melbourne is hazardous today due to the bushfires. The advises Melburnians should try…,1
6264,hazardous,Tatala Binangonan Rizal,Hazardous Taal eruption could affect power distribution – First Gen https://t.co/WHrud5GMOf,1
6265,hazardous,都内,"In the Philippines, Taal Volcano has errupted and it’s now under alert #4, a warning that a hazardous explosive eruption is…",1
6269,hazardous,#ImpeachTrump,"Taal volcano news – live: 'Hazardous eruption' set to hit Philippines within hours, authorities warn: Follow latest updates as…",1
6271,hazardous,East,"Due to the increasing levels of nitrogen dioxide caused by the #taalvolcano eruption, air quality with the reddish-brown p…",1
6272,hazardous,Glebe NSW Australia,"Victoria has recorded some of the most hazardous air quality in the world. If you're over 65, under 15, pregnant or you have a…",1
6273,hazardous,"Minnesota, USA",Melbourne's air quality 'worst in the world' as bushfires continue to burn across Victoria https://t.co/44wOfgYcSN,1
6275,hazardous,Sydney,"First Sydney then Canberra, now Melbourne - Melbourne's hazardous #AirPollution quality worst in the world overnight due to #A…",1
6276,hazardous,"Melbourne, Victoria",This Coalition MP has a message for all Victorians dealing with hazardous air quality today,1
6277,hazardous,Republic of the Philippines,"With the latest news on the eruption of Taal Volcano last (January 12, 2020), we advise the Lasallian community to stay safe…",1
6278,hazardous,philippians 4:13,"Alert Level 4 still remains in effect over Taal Volcano, according to Phivolcs update at 1PM on Tuesday. This means t…",1
6279,hazardous,"Melbourne, Australia",Updated air quality forecast for today and the next 3 days. MODERATE to HAZARDOUS conditions are forecast. EPA advises…,1
6280,hazardous,"Melbourne, Australia",. tennis organisers have been forced to delay the start of the qualifying tournament and suspend practic…,1
6284,hazardous,"Melbourne,  Australia",This Coalition MP has a message for all Victorians dealing with hazardous air quality today https://t.co/O7c2rd548Q,1
6286,hazardous,,"8:30am, EPA: ""all the Melbournians should try to stay indoors"" due to the hazardous AQI 9:30am, AO statement postponin…",1
6289,hazardous,,Hazardous air quality 😔😔😔 not untrue because this air is so bad https://t.co/i2ZLoCwXi3,1
6291,hazardous,"London, England",Why are none of the News Media reporting on this! Melbourne air quality drops to 'hazardous' levels as bushfire smo… https://t.co/g6e6R4mFUB,1
6292,hazardous,Cambridge,Melbourne choked by hazardous smoke as bushfires continue to burn across Victoria https://t.co/McmEpO9ZI3,1
6293,hazardous,,Tennis player quits after coughing fit at smoky qualifiers https://t.co/E1P3kgpLop It is outrageous that the…,1
6294,hazardous,Melbourne,Melbourne's air quality 'worst in the world' as bushfires continue to burn across Victoria https://t.co/yotDRLNqhc,1
6296,hazardous,"Melbourne, Australia","🎾 Dalila Jakupovic has been forced to retire from the Australian Open qualifiers, after suffering a coughing fit. The…",1
6297,hazardous,"Melbourne, Victoria",Melbourne's air quality 'worst in the world' as bushfires continue to burn across Victoria https://t.co/rq3B4SQnz5,1
6298,hazardous,"BKK, Thailand.","5. Due to hazardous smog and lack of sleep/rest, I have been sick multiple times (like now, I have bronchitis and I… https://t.co/Z51WL7FNCl",1
6304,hazardous,"Melbourne, Victoria",Melbourne air quality drops to 'hazardous' levels as bushfire smoke lingers over Victoria https://t.co/m1L1YhSgFr via,1
6312,hazardous,,The 'hazardous' air level due to the #bushfires in #Australia makes impossible to continue a match.… https://t.co/Po6AS1SwDp,1
6315,hazardous,ραѕιg ¢ιту,Trees and houses at the foot of Taal Volcano are partly buried in deep ashfall on Tuesday. Alert Level 4 still remain…,1
6325,heat%20wave,United States,Here we are in Australia in the middle of summer Trapped in our homes--the air outside filled with smoke from delibera…,1
6326,heat%20wave,,Here we are in Australia in the middle of summer Trapped in our homes--the air outside filled with smoke from delib… https://t.co/FJGaGEnSir,1
6346,heat%20wave,"Illinois, USA",A January heat wave engulfed the eastern half of the country.... The magnitude of the warmth was yet another remind… https://t.co/BVZASp3GAY,1
6347,heat%20wave,North America,Rescue dog in city care dies en route to new home during heat wave https://t.co/MdNlMPSa2d,1
6349,heat%20wave,India,"Bihar District Magistrate issued an order to close schools for ""heat wave."" In winter. Read: https://t.co/LXW1JF0TAW…",1
6350,heat%20wave,"Chandigarh, India",Bihar District Magistrate Issues Order to Close Schools for ‘Heat Wave’ Instead of ‘Cold Wave’… https://t.co/M1F8iJlsbO,1
6364,heat%20wave,,"#LatestNews #Trending A January heat wave engulfed the eastern half of the country, toppling records - The Washingt… https://t.co/7sgZ2p0Y5T",1
6365,heat%20wave,,"A January heat wave engulfed the eastern half of the country, toppling records https://t.co/aNuRxrmVAC",1
6428,hijack,,ISIS terror plot averted. TIMES NOW unmasks a sinister terror plot hatched by a module of 20 Islamist radicals to ‘hijack’ t…,1
6436,hijack,UK,Davinder Singh involved in negotiation of Kandahar flight hijack in 1999. Davinder Singh involved in parliament attack 2…,1
6449,hijack,"Cape Town, South Africa",HIJACK : REGENTS PARK. JHB. GP. GUN METAL GREY FORD FIESTA. XZT022GP.,1
6451,hijack,South Africa,HIJACK : REGENTS PARK. JHB. GP. GUN METAL GREY FORD FIESTA. XZT022GP.,1
6468,hijacker,,The hijacker on my account is logging in right now. Can you at least lock the account till everything… https://t.co/75ysSdf1Hd,1
6473,hijacker,South Africa 🇿🇦,"Hijacker funeral showed criminals had an upper hand over law enforcement, many ppl tortured &amp; police were not proac… https://t.co/ubVlpfnW50",1
6476,hijacker,,"Hi, my account's email has been hijacked, and the said email has been changed by the hijacker. They a… https://t.co/1dxZ5e5bFB",1
6497,hijacker,"Dhaka, Bangladesh","hey , my channel common raj has been hacked, and hijacker has deleted all the videos. And now they are livest…",1
6502,hijacker,kolkata,"https://t.co/6m0pd8p4ZQ hey , channel common raj has been hacked, and hijacker has deleted all t…",1
6516,hijacking,"Atlanta, GA 770-578-2344",LAW &amp; ORDER: Woman charged with DUI after allegedly hijacking vehicle - Cherokee Tribune Ledger News: https://t.co/zDoVVdsvEt,1
6526,hijacking,India,#DavinderSingh ‘s arrest having been caught redhanded with terrorists tells you how deep the wrought runs in Kashmir. How com…,1
6529,hijacking,,Cable Haunt: Hundreds of millions of cable modems may be vulnerable to hijacking attack https://t.co/2q2At6bwt8,1
6531,hijacking,In witness protection,Cable Haunt: Hundreds of millions of cable modems may be vulnerable to hijacking attack https://t.co/2q2At6bwt8,1
6532,hijacking,,Cable Haunt: Unknown millions of Broadcom-based cable modems open to hijacking https://t.co/1PFJNwiT3X,1
6538,hijacking,,".. 24 Aug 1984 to Lahore (5th such incident, btw), the Pakis found out that the hijacking was done with a toy pistol and in o…",1
6539,hijacking,"Kolkata, India","DySP Davinder Singh, who was posted with Srinagar airport’s anti-hijacking unit, was suspended on Monday. https://t.co/…",1
6544,hijacking,"London, England",They have been hijacking and burning people’s cars since yesterday. Now they are mowing people down... These criminals are just…,1
6556,hijacking,"Mumbai, India","On Sunday Davinder Singh, posted with the strategic anti-hijacking team at Srinagar airport, was arrested along wit… https://t.co/zZIOMtDNpJ",1
6557,hijacking,"Oxford, England",Allegedly they killed the civilian after hijacking his car but left the SP after hijacking his car. Doesn't make sense.,1
6568,hostage,Africa🌏,"The security forces of Nigeria are working continuously to return those taken hostage by Boko Haram to their families, friend…",1
6574,hostage,hara’s forehead,"January 13, 2019—Exactly one year ago 's Marzieh Hashemi was taken hostage by the U.S. government. Reuters sai…",1
6579,hostage,"North West, England","""Will she ever get home?"" Richard Ratcliffe's wife Nazanin Zaghari-Ratcliffe has been in prison in Iran since 2016. H…",1
6624,hostage,"Sedona, AZ","From CTmagazine: This Nigerian pastor was kidnapped by Boko Haram last week. In the hostage video, Lawan Andimi too… https://t.co/DgZmxFVide",1
6635,hostages,"Addis Ababa, Ethiopia",The abductors made several of their hostages to contact their parents and let them know that they were alive. Meanw… https://t.co/OqVymoVoRv,1
6639,hostages,Ethiopia,In early December between 17-27 students fleeing violence at their campus were kidnapped while aboard busses…,1
6640,hostages,Addis Ababa,"72 hours later, the whereabouts of any of the supposedly freed students haven't been revealed. None of the families have r…",1
6645,hostages,"Addis Ababa, Ethiopia","72 hours later, the whereabouts of any of the supposedly freed students haven't been revealed. None of the families… https://t.co/MV569iGxrG",1
6649,hostages,"San Antonio, TX",MASTER SYSTEM MONDAY: CHOPLIFTER In 1986 Sega pilots went behind enemy lines in order to rescue hostages in prisoner of…,1
6652,hostages,"Addis Ababa, Ethiopia",In early December between 17-27 students fleeing violence at their campus were kidnapped while aboard… https://t.co/mxHZKT6WIa,1
6658,hostages,,"O Lord, please protect the 40 seminarians who were taken hostages in Nigeria! Praying too that none were killed when th…",1
6686,hostages,"England, United Kingdom",Young babies taken away from their nursing moms 2 be hostages for rest of their lifes #BABYKILLERS #SOULEATERS https://…,1
6687,hostages,"Dublin City, Ireland","My colourised footage of the British Pathé film ""Guerilla Warfare In Ireland (1922)"" which shows the treatment of hostages…",1
6696,hurricane,,Ocean temperatures hit record highs as rate of global warming accelerates https://t.co/yS3nST7lN9,1
6708,hurricane,New Zealand,"A powerful North Atlantic windstorm with violent hurricane-force winds and major waves, smashing the huge cliffs on th…",1
6712,hurricane,,"Public art, protest art and resistance in Puerto Rico after the hurricane and #veranodel2019 https://t.co/yjdCr0WGH1",1
6717,hurricane,United Kingdom,"#USA: Given the vulnerabilities of #PuertoRico’s electric grid after Hurricane Maria, the EDF says there is an urge… https://t.co/eCV6xOjULQ",1
6724,hurricane,United States,Hurricane Recovery for Forest and Conservation Nurseries | via https://t.co/L008wXTTjL #agchat,1
6729,hurricane,"Colorado, USA",Jill the squirrel can't be without her teddy bear following rescue from a hurricane. Traumatized humans deserve the same c…,1
6731,hurricane,"Hyderabad, India","In the wake of Hurricane Harvey, grew its volunteer base from 8 to over 83,000 to rebuild Houston -- u… https://t.co/Q5KCyXoYIq",1
6754,injured,,"Overall death toll of 669; 25,000 injured since the Iraqi Protests started, according to This is insane!",1
6758,injured,All over Ireland,"The occupants, a female, two males and a baby, were awoken by two loud bangs. No one was injured. ATO deployed to s… https://t.co/JkV3Y9EmWf",1
6759,injured,,"School bus attacked with crude bombs in Uttar Pradesh&amp;#039;s Prayagraj, 2 students injured https://t.co/3NZ3bJkbMl",1
6760,injured,"Ranchi, India",Delhi: A delegation of top human rights body will interact with Jamia students injured in the December 15 violence. More on htt…,1
6763,injured,"London, England","Lovren, Shaqiri, Keita have all been injured at certain points and their replacements have come in an… https://t.co/KCZeH521Gj",1
6764,injured,,"BREAKING: Huge sinkhole swallows bus in northwest China; at least 6 dead, 16 injured, and 4 missing https://t.co/m12xBPxruu",1
6765,injured,Iran occupied,🔴Warning Repressive forces of the Islamic Republic have fired on Iranian protesters. Local sources say 7 people were…,1
6772,injured,"Johannesburg, South Africa",In all seriousness I'm glad nobody was seriously injured. Could have been worse.,1
6774,injured,,Volunteers around Australia are caring for wildlife injured and orphaned in the bushfires. #abc730 #AustralianBushf…,1
6776,injured,Ohio River Valley,"Iran Protests: 1,500 killed 5,000 Injured 7,000 arrested Reactions: U.N: 0 Resolutions,Urgent Sessions, or Commission…",1
6777,injured,LiberalsR VIRTUE SIGNALLINGpos,🔴Breaking News Oppressive forces of the Islamic Republic in Tehran have fired on people. Several people have been inj…,1
6778,injured,"England, United Kingdom","🇮🇷 Iran protests in past two months: 1,500 protesters killed by regime 4,800 Injured 7,000 arrested 🇺🇳 Reaction from U.N.…",1
6784,injured,,"On January 9,1992 , 10 Persons were killed and 5 others injured by Khalistani Terrorists in KupKalan in Sangrur, Punjab. #…",1
6785,injured,"Hampton, VA Ultra V.I.P Events","New Tumblr post: ""Information Out Of Colorado Springs 8 People Injured In A..."" https://t.co/oPjZsleZEm Instagram, IFTTT",1
6786,injured,"Hampton, VA Ultra V.I.P Events","New Tumblr post: ""Information Out Of Colorado Springs 8 People Injured In A..."" https://t.co/2bGP1eXNKe Instagram, IFTTT",1
6787,injured,"Owerri, Imo State Nigeria",Colorado police arrest suspect after 8 injured in apparent ‘random’ stabbing – National https://t.co/rD4WpnroQf,1
6788,injured,,"Today we honor Lithuanian 🇱🇹 citizens who stood up to &amp; peacefully resisted the Soviet military in January, 1991. Unarmed c…",1
6789,injured,"Vantaa, FINLAND","Matthew Dingley, 28, allegedly beat a flight attendant, tried to enter the cockpit and injured several police in a viol…",1
6790,injured,,"29 years ago, on that dark cold night, thousands of Lithuanians stood unarmed against Soviet tanks &amp; defended our reborn…",1
6791,injured,,"A child, little Richard Clarke, 7 years old, was murdered on 14th January, by a bomb placed in a ventilator and a lady was in…",1
6796,injuries,"Elmbridge, Surrey, UK",Pedestrian left with life-changing injuries following Oxshott collision - can you help? https://t.co/MEH49oeEGA,1
6797,injuries,North West England,"Report recieved of a 9 vehicle RTC on M66 between jct 2 and 3, No reports of any injuries, but 2 lanes blocked …",1
6799,injuries,,Two cruciate ligament injuries in one game. A bad day for young Serie A stars 😢 https://t.co/HgwtnwawcV,1
6804,injuries,,Isiah dealt with major injuries that forced him to retire ( somewhat early ) towards the end… https://t.co/ZhMf16mscn,1
6807,injuries,,"28-year-old daily-wage worker from firozabad, Mohammad Abrar, who took a bullet in his spinal cord on December 20, succumbed t…",1
6815,injuries,UK,North East Wales Search and Rescue lower mountain biker with multiple injuries 100m down muddy forest slope to safe… https://t.co/m1O2RwC7xu,1
6817,injuries,"Peel Region, Ontario","Robbery - Rabba Fine Foods - 20 Bristol Road West, #Mississauga. Two masked culprits, no weapons seen. No injuries,… https://t.co/pbMPRrXuZU",1
6821,injuries,Dorchester,Dorset Police employees seek compensation over injuries on duty https://t.co/CHNgeUDGS4,1
6822,injuries,Maldives,• 29 injuries to 16 players. And that was only until Jan. 2 more injuries to Benzema &amp; Bale. • Squad void of motivation…,1
6827,injuries,"Seattle, WA",Here is another picture from the scene courtesy of LT Longoria. Approximately 30 cars involved in numerous separate collision…,1
6829,injuries,Manila,Angkas once again suffering from back injuries for carrying the Ph government https://t.co/TzCr3sUjEo,1
6836,injuries,"Siracusa, Sicilia",Frank the kangaroo left with horrific injuries after sick and cruel yobs shoot him with arrows ‘for fun https://t.co/866d…,1
6837,injuries,"Peel Region, Ontario","Armed Robbery - P200016171 - 7/11 Convenience Store located at 6980 Lisgar Dr, #Mississauga. Two culprits armed wit… https://t.co/yvj0MzNY1W",1
6838,injuries,"Kansas City, Mo.","Reports of active shooter near school in Virginia, police say no injuries https://t.co/c35rcPfuUg",1
6841,injuries,"Ottawa, Ontario",WORKING FIRE: Ottawa Fire Services on scene of the 1800 block of Russell Rd for a working fire in a multi unit building.…,1
6843,injuries,UK,"RT from Jalopnik Michigan's 75 mph speed limit has lead to more speeding, crashes, and injuries: report… https://t.co/kYpRy6qtnN",1
6844,injuries,UK,"RT from Jalopnik Michigan's 75 mph speed limit has lead to more speeding, crashes, and injuries: report https://t.co/IpldR3hs4c",1
6845,injuries,"Clarence-Rockland, Ontario",WORKING FIRE: Ottawa Fire Services on scene of the 1800 block of Russell Rd for a working fire in a multi unit buil… https://t.co/GkDREoPDZI,1
6847,injury,,"Pogba, McTominay, Lingard, Shaw - Manchester United injury news latest and expected return dates https://t.co/AQlH3mi7fN",1
6849,injury,"Los Angeles, Ca",OLIVE IS FRIENDLY BUT TENTATIVE - maybe because she has a leg injury and is in pain? These people who seem to know noth…,1
6852,injury,Sin City,Anybody got a status update on Dale Dabone? He had a pretty serious injury not too long ago. Hope he's on the mend.,1
6853,injury,Tottenham Hotspur,Chris Sutton names the Chelsea star who could benefit from Harry Kane's injury blow https://t.co/bGiVMvNtvY https://t.co/0EbRzegvz2,1
6854,injury,Everywhere,Suarez’s injury is a blessing in disguise for Setien. He’s not forced to start Suarez every game subsequently giving Fati…,1
6870,injury,Somewhere drinking Hennessy,https://t.co/e0FNv0z4WD New article on the blog focused on whether Arsenal can cope with Torreira's injury,1
6871,injury,"Sydney, New South Wales",Horrible news about mose masoe. Does anybody know the extent of the injury? Hoping for a speedy recovery for the big man,1
6873,injury,"Lagos, Nigeria",https://t.co/GjgMIw0k3O New article on the blog focused on whether Arsenal can cope with Torreira's injury… https://t.co/xswria9nOS,1
